id,type,text1,text2,text3,text4,text5,notes
junk_pirates_anarchist_researchbase,CUSTOM,"This research station bears the markings of Pre-P.A.C.K. anarchist groups. It appears abandoned, but the equipment inside is too well-preserved and too specialized to be harmless. Old analysis rigs, sealed labs, and half-powered archives suggest work whose purpose did not survive its owners.",,,,,
junk_pirates_anarchist_mining,CUSTOM,"This mining station bears the markings of Pre-P.A.C.K. anarchist groups. Decommissioned rigs drift beside ambiguous sensor returns and sealed storage pockets. Whether the site was abandoned, sabotaged, or deliberately left as bait is not immediately clear.",,,,,
junk_pirates_anarchist_habitat,CUSTOM,"This habitat bears the markings of Pre-P.A.C.K. anarchist groups. Emergency power still flickers across docking bays and habitation rings, suggesting either recent abandonment or systems built to outlast the people who trusted them.",,,,,
,,,,,,,
pack_anarchist_station1,SHIP,"An orbital station bearing the markings of Pre-PACK Anarchist Groups. This platform hosts shipyards, habitats, factories, and large stockpiles of weapons and supplies allowing projection of military and industrial power throughout the local orbital volume.",,,,,
pack_anarchist_station2,SHIP,"An orbital station bearing the markings of Pre-PACK Anarchist Groups. This platform hosts shipyards, habitats, factories, and large stockpiles of weapons and supplies allowing projection of military and industrial power throughout the local orbital volume.",,,,,
,,,,,,,
vayra_electrochafflauncher,SHIP_SYSTEM,"Launches chaff particles carrying a heavy electrostatic charge to interfere with the targeting systems of hostile PD weapons and incoming missiles. After a short charging period, chaff will release an EMP arc targeting a nearby hostile missile within a small radius.",Defensive,Launches electrostatically charged chaff particles to defend against nearby enemy missiles.,,,
,,,,,,,
vayra_electrobeam,WEAPON,"A long-ranged energy support weapon, firing an unstable stream of ionized particles with the notable side effect of converting whatever it strikes into a 'lightning rod' for nearby electrostatically charged debris. Relatively undemanding in terms of engineering and support profile, though its efficacy leaves something to be desired.

A junk-built knockoff of the sector-standard Bhilai Exospace Ion Beam, the Electrostatic Shock Beam is claimed by Junk Pirate oral history to be reverse-engineered from a prototype stolen - usually, by incredible coincidence, by whoever happens to be telling the story - from the Chernobog Proving Grounds. The veracity of this information is somewhat in doubt, not least due to the claimed date of this event being significantly before the Collapse.",Close Support,,,,
vayra_scrapcannon,WEAPON,"A robust and inexpensive autocannon with generous engineering specifications, easily mounted even to light vessels or those lacking in flux infrastructure. Nonstandard 'scrap' rounds produce unpredictable, though generally disappointing, effects on target.

The GA-X Industries Mk. I 'Scrapper' Autocannon, long out of production even before the Collapse, was once widely boasted to be capable of firing anything that would fit into the breech. Of course, when the blueprint was rediscovered in a remote Domain derelict outpost by Junk Pirate scavengers along with a filing cabinet full of incredibly preserved period advertising material,  they took this as a challenge. Now back in steady use after uncounted centuries, the Junk Pirate 'standard' loadings for the Scrapper consist of grapeshot, heavy packing grease, non-Newtonian fluids, stale pizza crusts, stolen silverware, and everything in between.",Assault,,,,
vayra_scrapnailer,WEAPON,"A piece of standard industrial equipment turned starship armament, the affectionately christened 'Scrap Nailer' has been retooled to fire meter-long jagged spikes cut from scrap steel, damaged armor plating, or really just about any conductive metal that happens to be laying about.",Close Support,,,,
vayra_junkjet_rack,WEAPON,"More of a broad identification category than a discrete 'class' of weapons, the only traits universally shared by 'Scrapjet' missiles are their powerful engines, mid-weight payloads, and frankly deficient targeting systems. This particular weapon mount consists of four Scrapjets crudely affixed to a jury-rigged missile rack by a series of suspiciously oversized explosive bolts.",Close Support,,,,
vayra_junkjet_pod,WEAPON,"More of a broad identification category than a discrete 'class' of weapons, the only traits universally shared by 'Scrapjet' missiles are their powerful engines, mid-weight payloads, and frankly deficient targeting systems. This particular weapon mount consists of a standard double-arm missile rack fed by internal magazines routinely loaded far beyond their stated maximum capacity.",Close Support,,,,
junk_pirates_mlrs,WEAPON,"The Micro Scrapjet MLRS system fires a smaller version of her big sister the Scrapjet in the Micro Scrapjet. Similar behaviour is to be expected; with the various warhead types and including no particular guarantees that adjacent barn doors will be hit.

This MLRS fires micro scrapjets in extended ‘lucky dip’ salvoes of 8 and can be found on the right arm of the Orca pleasure craft.",,,,,
junk_pirates_cruiser_burst_jets,SHIP_SYSTEM,"Dumping cryo-liquids from half-tonne Vacuum Insulated Evaporator tanks straight in to and around the cooling jackets of the ships engines allows for large ships to perform minor miracles in manoeuvrability – at least for a short while. The used vessels when ejected break up to form electrostatically charged debris which functionally act as flares.

In theory this will massively shorten the economic life of the particular vessels engine train and in order to mollify the engineering teams is often applied with a simple modification to allow for the efficient production and packaging of frozen dairy products.",Movement,Increases mobility and provides for flare-like discharge of cryo-liquid ‘plugs’.,,,
junk_pirates_spinerette_base,SHIP,"This is a huge, slithering mass of incoherent and unidentifiable modules, vaguely arranged in an Arachnoid manner. Strong energy signatures emanate from the central pod arrangement and a full-spectrum scan of this … thing … reveals no organic life.",,,,,
,,,,,,,
syndicate_asp_credit_chip,RESOURCE,"Even though the majority of financial transactions can be carried out remotely and reliably from just about any point in the sector, sometimes this hyper-connectedness can lead to a level of scrutiny that certain individuals do not always appreciate.

In that case, physically moving money by decrypted credit chips is an archaic (but widely accepted) way to ensure a certain level of opacity can be maintained, which works great assuming you can trust whoever is carrying your chips for you.",,,,,
