name,id,tags,tech/manufacturer,rarity,base price,stack size,cargo space,baseRaidDanger,icon,sound id,sound id drop,plugin,plugin params,desc,order
Junk Pirates Blueprint Package,junk_pirates_junk_bp,package_bp,,,30000,1000,1,,graphics/icons/cargo/blueprint_lowtech.png,ui_chip_pickup,ui_bp_package_drop,com.fs.starfarer.api.campaign.impl.items.MultiBlueprintItemPlugin,junk_pirates_junk_bp,"Enables heavy industry to construct the more common ship hulls, weapons, and fighter LPCs from the Junk Pirates faction.",200
Junk Pirates Advanced Blueprint Package,junk_pirates_junkprime_bp,package_bp,,0.8,50000,1000,1,,graphics/icons/cargo/blueprint_lowtech.png,ui_chip_pickup,ui_bp_package_drop,com.fs.starfarer.api.campaign.impl.items.MultiBlueprintItemPlugin,junk_pirates_junkprime_bp,"Enables heavy industry to construct a select few of the more advanced ship hulls, weapons, and fighter LPCs from the Junk Pirates faction.",210
ASP Syndicate Blueprint Package,junk_pirates_asp_bp,package_bp,,,30000,1000,1,,graphics/icons/cargo/blueprint_hightech.png,ui_chip_pickup,ui_bp_package_drop,com.fs.starfarer.api.campaign.impl.items.MultiBlueprintItemPlugin,junk_pirates_asp_bp,"Enables heavy industry to construct the more common ship hulls, weapons, and fighter LPCs from the ASP Syndicate.",220
PACK Blueprint Package,junk_pirates_pack_bp,package_bp,,,30000,1000,1,,graphics/icons/cargo/blueprint_midline.png,ui_chip_pickup,ui_bp_package_drop,com.fs.starfarer.api.campaign.impl.items.MultiBlueprintItemPlugin,junk_pirates_pack_bp,"Enables heavy industry to construct the more common ship hulls, weapons, and fighter LPCs from the P.A.C.K.",230
PACK Advanced Blueprint Package,junk_pirates_packprime_bp,package_bp,,0.8,50000,1000,1,,graphics/icons/cargo/blueprint_midline.png,ui_chip_pickup,ui_bp_package_drop,com.fs.starfarer.api.campaign.impl.items.MultiBlueprintItemPlugin,junk_pirates_packprime_bp,"Enables heavy industry to construct a select few of the more advanced ship hulls, weapons, and fighter LPCs from the P.A.C.K.",240
ASP Familia Blueprint Package,junk_pirates_familia_bp,package_bp,,0.5,150000,1000,1,,graphics/icons/cargo/blueprint_hightech.png,ui_chip_pickup,ui_bp_package_drop,com.fs.starfarer.api.campaign.impl.items.MultiBlueprintItemPlugin,junk_pirates_familia_bp,"Enables heavy industry to construct the more common ship hulls, weapons, and fighter LPCs from the shadowy ASP Syndicate Familia.",250
